[
  {"id": "W4234035687", "tier": "OUT", "genre": "other", "about_ca": false, "confidence": "high", "reason": "Mathematics textbook chapter on contour integration; a mathematical technique, not a research method under study."},
  {"id": "W4297232891", "tier": "OUT", "genre": "empirical", "about_ca": false, "confidence": "high", "reason": "Astrophysics of black holes and density cusps."},
  {"id": "W2054209498", "tier": "OUT", "genre": "empirical", "about_ca": false, "confidence": "high", "reason": "Plant genetics marker development."},
  {"id": "W4410513505", "tier": "OUT", "genre": "empirical", "about_ca": false, "confidence": "high", "reason": "Clinical study of quality of life in prostate cancer survivors."},
  {"id": "W4390122090", "tier": "OUT", "genre": "empirical", "about_ca": false, "confidence": "high", "reason": "Operations research on crew scheduling."},
  {"id": "W2925252095", "tier": "OUT", "genre": "empirical", "about_ca": false, "confidence": "high", "reason": "Communication study of Twitter use in disaster management."},
  {"id": "W6902092293", "tier": "OUT", "genre": "dataset", "about_ca": false, "confidence": "high", "reason": "Supplementary material for a post-hoc clinical trial analysis of cognitive outcomes."},
  {"id": "W4221103062", "tier": "OUT", "genre": "editorial", "about_ca": false, "confidence": "medium", "reason": "Editorial introduction to a themed education issue on youth engagement; the subject is schooling, not research practice."},
  {"id": "W6904823124", "tier": "OUT", "genre": "other", "about_ca": false, "confidence": "high", "reason": "Archival ephemera (an addressed envelope)."},
  {"id": "W2801261091", "tier": "OUT", "genre": "empirical", "about_ca": false, "confidence": "high", "reason": "Molecular immunology of inflammasome activation."},
  {"id": "W7001747557", "tier": "OUT", "genre": "other", "about_ca": false, "confidence": "medium", "reason": "Video capsule presenting a nature-based teaching approach; a pedagogical resource, not a study of research."},
  {"id": "W2049826059", "tier": "OUT", "genre": "other", "about_ca": false, "confidence": "high", "reason": "Teaching and learning guide for a literature course; classroom pedagogy, not research practice."},
  {"id": "W2154753732", "tier": "OUT", "genre": "empirical", "about_ca": false, "confidence": "high", "reason": "Pricing model for wireless networks."},
  {"id": "W2460642928", "tier": "OUT", "genre": "empirical", "about_ca": false, "confidence": "high", "reason": "Microbiology of antifungal resistance mutations."},
  {"id": "W7117318897", "tier": "OUT", "genre": "empirical", "about_ca": false, "confidence": "high", "reason": "Preclinical pharmacology in an Alzheimer's mouse model."},
  {"id": "W4251652261", "tier": "OUT", "genre": "empirical", "about_ca": false, "confidence": "high", "reason": "Engineering thesis on battery preheating systems."},
  {"id": "W6923323160", "tier": "OUT", "genre": "other", "about_ca": false, "confidence": "low", "reason": "No abstract; a digitized mining trade journal record with no research-practice object."},
  {"id": "W4403725695", "tier": "OUT", "genre": "empirical", "about_ca": false, "confidence": "high", "reason": "Clinical registry analysis of ostomy outcomes; 'research registry' names the data source, not the object."},
  {"id": "W3173586783", "tier": "OUT", "genre": "other", "about_ca": false, "confidence": "medium", "reason": "Collected conference abstracts whose content is cancer genetics."},
  {"id": "W2032912948", "tier": "T2", "genre": "other", "about_ca": false, "confidence": "medium", "reason": "Sociology of science essay confronting Mertonian and Bourdieusian accounts of how the scientific system produces gender discrimination; STS treatment of research workforce equity."},
  {"id": "W6950014426", "tier": "OUT", "genre": "empirical", "about_ca": false, "confidence": "high", "reason": "Taxonomic description of a new coral species."},
  {"id": "W4386494984", "tier": "OUT", "genre": "empirical", "about_ca": false, "confidence": "high", "reason": "Antenna feeding network engineering."},
  {"id": "W2007712551", "tier": "OUT", "genre": "empirical", "about_ca": false, "confidence": "high", "reason": "Developmental neurophysiology of infant postural control."},
  {"id": "W2543932101", "tier": "OUT", "genre": "other", "about_ca": false, "confidence": "high", "reason": "Intellectual history of pre-war Japanese thought."},
  {"id": "W3104936069", "tier": "OUT", "genre": "empirical", "about_ca": false, "confidence": "high", "reason": "Thermal engineering of latent heat storage."},
  {"id": "W1685527554", "tier": "OUT", "genre": "methods", "about_ca": false, "confidence": "medium", "reason": "NLP model for clinical text de-identification; the paper studies the algorithm's accuracy, not the data-sharing infrastructure it could serve."},
  {"id": "W2160167924", "tier": "OUT", "genre": "methods", "about_ca": false, "confidence": "medium", "reason": "Exposure-measurement validation in occupational hygiene; a domain measurement question."},
  {"id": "W6994411268", "tier": "OUT", "genre": "other", "about_ca": false, "confidence": "low", "reason": "Newsletter item announcing new clinical faculty; T3 lists news items but this one concerns clinical staffing, not the research ecosystem."},
  {"id": "W2434533707", "tier": "OUT", "genre": "review", "about_ca": false, "confidence": "high", "reason": "Systematic review of trials answering a clinical question about bisphosphonates."},
  {"id": "W2948008988", "tier": "OUT", "genre": "empirical", "about_ca": false, "confidence": "medium", "reason": "No abstract; financial econometrics of volatility forecasting."},
  {"id": "W7053346309", "tier": "OUT", "genre": "methods", "about_ca": false, "confidence": "medium", "reason": "Evaluation of an inoculation technique for screening soybean resistance; a domain laboratory method, not a research practice."},
  {"id": "W2724298860", "tier": "OUT", "genre": "empirical", "about_ca": false, "confidence": "high", "reason": "Forest ecology of silvicultural treatments."},
  {"id": "W2606909087", "tier": "OUT", "genre": "other", "about_ca": false, "confidence": "high", "reason": "Philosophy thesis on Nietzsche."},
  {"id": "W4406480540", "tier": "OUT", "genre": "other", "about_ca": false, "confidence": "low", "reason": "Title is a bare DOI string with no abstract; geoscience topic suggests domain content."},
  {"id": "W3037925455", "tier": "OUT", "genre": "review", "about_ca": false, "confidence": "high", "reason": "No abstract; review of liquid biopsy applications in oncology."},
  {"id": "W2552041352", "tier": "OUT", "genre": "methods", "about_ca": false, "confidence": "medium", "reason": "Translation quality assessment applied to a university motto; the method assessed is translation, not research."},
  {"id": "W3161228155", "tier": "OUT", "genre": "empirical", "about_ca": false, "confidence": "high", "reason": "Astronomy of globular cluster kinematics."},
  {"id": "W4283693384", "tier": "OUT", "genre": "empirical", "about_ca": false, "confidence": "medium", "reason": "Reanalysis showing a gravitational-wave inference depends on glitch modeling; sensitivity is examined, but what we learn about is the physical event."},
  {"id": "W2731484330", "tier": "OUT", "genre": "empirical", "about_ca": false, "confidence": "high", "reason": "Criminology dissertation on missing persons."},
  {"id": "W2171461786", "tier": "OUT", "genre": "empirical", "about_ca": false, "confidence": "high", "reason": "Vascular biology in hyperlipidemic mice."},
  {"id": "W6888798687", "tier": "OUT", "genre": "dataset", "about_ca": false, "confidence": "medium", "reason": "Release of a Swedish FrameNet lexical resource; the data are linguistic content, and the FAIR documentation is an instance of good practice, not a study of it."},
  {"id": "W1560953817", "tier": "OUT", "genre": "empirical", "about_ca": false, "confidence": "high", "reason": "Feminist analysis of a filmmaking collaboration."},
  {"id": "W2054204499", "tier": "OUT", "genre": "empirical", "about_ca": false, "confidence": "high", "reason": "Agronomy of cassava pruning and yield."},
  {"id": "W3006437174", "tier": "OUT", "genre": "other", "about_ca": false, "confidence": "low", "reason": "Abstract is only 'National audience'; title indicates a rural agriculture program study."},
  {"id": "W1778915173", "tier": "T2", "genre": "review", "about_ca": false, "confidence": "low", "reason": "Quantitative review that characterizes how the urban ecosystem-service literature is conducted (single-city designs, western bias, neglected service types), so the object is partly the research corpus, in the borderline sense of the rubric's bibliometric example."},
  {"id": "W1965748901", "tier": "OUT", "genre": "other", "about_ca": false, "confidence": "medium", "reason": "No abstract; a theoretical physics note on gravitational redshift."},
  {"id": "W3189917904", "tier": "OUT", "genre": "empirical", "about_ca": false, "confidence": "high", "reason": "Molecular physiology of alpha-synuclein and insulin secretion."},
  {"id": "W4406221354", "tier": "OUT", "genre": "empirical", "about_ca": false, "confidence": "high", "reason": "Vaccine immunogenicity study in chickens."},
  {"id": "W2606532563", "tier": "OUT", "genre": "review", "about_ca": false, "confidence": "high", "reason": "Clinical review of nitrous oxide use in labor."},
  {"id": "W4406520568", "tier": "OUT", "genre": "other", "about_ca": false, "confidence": "low", "reason": "Title is a bare DOI string with no abstract; cardiology topic suggests clinical content."}
]
