[{"id": "W2072326561", "tier": "OUT", "genre": "other", "about_ca": false, "confidence": "high"}, {"id": "W2080287326", "tier": "OUT", "genre": "other", "about_ca": false, "confidence": "high"}, {"id": "W2085215116", "tier": "OUT", "genre": "other", "about_ca": false, "confidence": "high"}, {"id": "W2081466779", "tier": "OUT", "genre": "other", "about_ca": false, "confidence": "high"}, {"id": "W2083458225", "tier": "OUT", "genre": "other", "about_ca": false, "confidence": "high"}, {"id": "W2077402322", "tier": "OUT", "genre": "other", "about_ca": false, "confidence": "high"}, {"id": "W2086891449", "tier": "OUT", "genre": "other", "about_ca": false, "confidence": "high"}, {"id": "W2085434437", "tier": "OUT", "genre": "other", "about_ca": false, "confidence": "high"}, {"id": "W2076188495", "tier": "OUT", "genre": "other", "about_ca": false, "confidence": "high"}, {"id": "W2094314285", "tier": "OUT", "genre": "other", "about_ca": false, "confidence": "high"}, {"id": "W2094631695", "tier": "OUT", "genre": "other", "about_ca": false, "confidence": "high"}, {"id": "W2089123927", "tier": "OUT", "genre": "other", "about_ca": false, "confidence": "high"}, {"id": "W2088627390", "tier": "OUT", "genre": "other", "about_ca": false, "confidence": "high"}, {"id": "W2086549257", "tier": "OUT", "genre": "other", "about_ca": false, "confidence": "high"}, {"id": "W2054896185", "tier": "OUT", "genre": "other", "about_ca": false, "confidence": "high"}, {"id": "W2057811708", "tier": "OUT", "genre": "other", "about_ca": false, "confidence": "high"}, {"id": "W2060221993", "tier": "OUT", "genre": "other", "about_ca": false, "confidence": "high"}, {"id": "W2051704649", "tier": "OUT", "genre": "other", "about_ca": false, "confidence": "high"}, {"id": "W2053690301", "tier": "OUT", "genre": "other", "about_ca": false, "confidence": "high"}, {"id": "W2055033763", "tier": "OUT", "genre": "other", "about_ca": false, "confidence": "high"}, {"id": "W2052650554", "tier": "OUT", "genre": "other", "about_ca": false, "confidence": "high"}, {"id": "W2052292401", "tier": "OUT", "genre": "other", "about_ca": false, "confidence": "high"}, {"id": "W2050076853", "tier": "OUT", "genre": "other", "about_ca": false, "confidence": "high"}, {"id": "W2051369986", "tier": "OUT", "genre": "other", "about_ca": false, "confidence": "high"}, {"id": "W2052317746", "tier": "OUT", "genre": "other", "about_ca": false, "confidence": "high"}, {"id": "W2059016640", "tier": "OUT", "genre": "other", "about_ca": false, "confidence": "high"}, {"id": "W2059106526", "tier": "OUT", "genre": "other", "about_ca": false, "confidence": "high"}, {"id": "W2056416291", "tier": "OUT", "genre": "other", "about_ca": false, "confidence": "high"}, {"id": "W2053915543", "tier": "OUT", "genre": "other", "about_ca": false, "confidence": "high"}, {"id": "W2055053450", "tier": "OUT", "genre": "other", "about_ca": false, "confidence": "high"}, {"id": "W2061554266", "tier": "OUT", "genre": "other", "about_ca": false, "confidence": "high"}, {"id": "W2066294710", "tier": "OUT", "genre": "other", "about_ca": false, "confidence": "high"}, {"id": "W2062186287", "tier": "OUT", "genre": "other", "about_ca": false, "confidence": "high"}, {"id": "W2051816153", "tier": "OUT", "genre": "other", "about_ca": false, "confidence": "high"}, {"id": "W2059275938", "tier": "OUT", "genre": "other", "about_ca": false, "confidence": "high"}, {"id": "W2058688360", "tier": "OUT", "genre": "other", "about_ca": false, "confidence": "high"}, {"id": "W2049707766", "tier": "OUT", "genre": "other", "about_ca": false, "confidence": "high"}, {"id": "W2061425254", "tier": "OUT", "genre": "other", "about_ca": false, "confidence": "high"}, {"id": "W2059909177", "tier": "OUT", "genre": "other", "about_ca": false, "confidence": "high"}, {"id": "W2067136367", "tier": "OUT", "genre": "other", "about_ca": false, "confidence": "high"}, {"id": "W2069656205", "tier": "OUT", "genre": "other", "about_ca": false, "confidence": "high"}, {"id": "W2055639695", "tier": "OUT", "genre": "other", "about_ca": false, "confidence": "high"}, {"id": "W2069582929", "tier": "OUT", "genre": "other", "about_ca": false, "confidence": "high"}, {"id": "W2054075548", "tier": "OUT", "genre": "other", "about_ca": false, "confidence": "high"}, {"id": "W2070758111", "tier": "OUT", "genre": "other", "about_ca": false, "confidence": "high"}, {"id": "W2059866170", "tier": "OUT", "genre": "other", "about_ca": false, "confidence": "high"}, {"id": "W2056591005", "tier": "OUT", "genre": "other", "about_ca": false, "confidence": "high"}, {"id": "W2068941104", "tier": "OUT", "genre": "other", "about_ca": false, "confidence": "high"}, {"id": "W2051439497", "tier": "OUT", "genre": "other", "about_ca": false, "confidence": "high"}, {"id": "W2064979447", "tier": "OUT", "genre": "other", "about_ca": false, "confidence": "high"}, {"id": "W2066563040", "tier": "OUT", "genre": "other", "about_ca": false, "confidence": "high"}, {"id": "W2066166115", "tier": "OUT", "genre": "other", "about_ca": false, "confidence": "high"}, {"id": "W4410218486", "tier": "OUT", "genre": "other", "about_ca": false, "confidence": "high"}, {"id": "W4410484490", "tier": "T1", "genre": "empirical", "about_ca": false, "confidence": "high"}, {"id": "W4410359658", "tier": "OUT", "genre": "other", "about_ca": false, "confidence": "high"}, {"id": "W4406682540", "tier": "OUT", "genre": "other", "about_ca": false, "confidence": "high"}, {"id": "W2062598831", "tier": "OUT", "genre": "other", "about_ca": false, "confidence": "high"}, {"id": "W2060680914", "tier": "OUT", "genre": "other", "about_ca": false, "confidence": "high"}, {"id": "W2062817974", "tier": "OUT", "genre": "other", "about_ca": false, "confidence": "high"}, {"id": "W2057349658", "tier": "OUT", "genre": "other", "about_ca": false, "confidence": "high"}, {"id": "W2050657310", "tier": "OUT", "genre": "other", "about_ca": false, "confidence": "high"}, {"id": "W2061106825", "tier": "OUT", "genre": "other", "about_ca": false, "confidence": "high"}, {"id": "W2067110336", "tier": "OUT", "genre": "other", "about_ca": false, "confidence": "high"}, {"id": "W2062352760", "tier": "OUT", "genre": "other", "about_ca": false, "confidence": "high"}, {"id": "W2057930230", "tier": "OUT", "genre": "other", "about_ca": false, "confidence": "high"}, {"id": "W2053240156", "tier": "OUT", "genre": "other", "about_ca": false, "confidence": "high"}, {"id": "W2063159691", "tier": "OUT", "genre": "other", "about_ca": false, "confidence": "high"}, {"id": "W2061755061", "tier": "OUT", "genre": "other", "about_ca": false, "confidence": "high"}, {"id": "W2053727118", "tier": "OUT", "genre": "other", "about_ca": false, "confidence": "high"}, {"id": "W2055896777", "tier": "OUT", "genre": "other", "about_ca": false, "confidence": "high"}, {"id": "W2065679735", "tier": "OUT", "genre": "other", "about_ca": false, "confidence": "high"}, {"id": "W2068790626", "tier": "OUT", "genre": "other", "about_ca": false, "confidence": "high"}, {"id": "W2060650207", "tier": "OUT", "genre": "other", "about_ca": false, "confidence": "high"}, {"id": "W2062398898", "tier": "OUT", "genre": "other", "about_ca": false, "confidence": "high"}, {"id": "W2057450946", "tier": "OUT", "genre": "other", "about_ca": false, "confidence": "high"}, {"id": "W2050257625", "tier": "OUT", "genre": "other", "about_ca": false, "confidence": "high"}, {"id": "W2056974070", "tier": "OUT", "genre": "other", "about_ca": false, "confidence": "high"}, {"id": "W2068324673", "tier": "OUT", "genre": "other", "about_ca": false, "confidence": "high"}, {"id": "W2057381165", "tier": "OUT", "genre": "other", "about_ca": false, "confidence": "high"}, {"id": "W2066912220", "tier": "OUT", "genre": "other", "about_ca": false, "confidence": "high"}, {"id": "W2057126116", "tier": "OUT", "genre": "other", "about_ca": false, "confidence": "high"}, {"id": "W2059454338", "tier": "OUT", "genre": "other", "about_ca": false, "confidence": "high"}, {"id": "W2061735499", "tier": "OUT", "genre": "other", "about_ca": false, "confidence": "high"}, {"id": "W2049987718", "tier": "OUT", "genre": "other", "about_ca": false, "confidence": "high"}, {"id": "W2069565027", "tier": "OUT", "genre": "other", "about_ca": false, "confidence": "high"}, {"id": "W2069904235", "tier": "OUT", "genre": "other", "about_ca": false, "confidence": "high"}, {"id": "W2070859214", "tier": "OUT", "genre": "other", "about_ca": false, "confidence": "high"}, {"id": "W2062794120", "tier": "OUT", "genre": "other", "about_ca": false, "confidence": "high"}, {"id": "W2056150545", "tier": "OUT", "genre": "other", "about_ca": false, "confidence": "high"}, {"id": "W2054276476", "tier": "OUT", "genre": "other", "about_ca": false, "confidence": "high"}, {"id": "W2052963801", "tier": "OUT", "genre": "other", "about_ca": false, "confidence": "high"}, {"id": "W2053803086", "tier": "OUT", "genre": "other", "about_ca": false, "confidence": "high"}, {"id": "W2067968687", "tier": "OUT", "genre": "other", "about_ca": false, "confidence": "high"}, {"id": "W2052864433", "tier": "OUT", "genre": "other", "about_ca": false, "confidence": "high"}, {"id": "W2055159539", "tier": "OUT", "genre": "other", "about_ca": false, "confidence": "high"}, {"id": "W2062203284", "tier": "OUT", "genre": "other", "about_ca": false, "confidence": "high"}, {"id": "W2056797193", "tier": "OUT", "genre": "other", "about_ca": false, "confidence": "high"}, {"id": "W2057691077", "tier": "OUT", "genre": "other", "about_ca": false, "confidence": "high"}, {"id": "W2059809384", "tier": "OUT", "genre": "other", "about_ca": false, "confidence": "high"}, {"id": "W2054796636", "tier": "OUT", "genre": "other", "about_ca": false, "confidence": "high"}]