[{"id": "W4249543373", "tier": "OUT", "genre": "other", "about_ca": false, "confidence": "high", "reason": "Domain analysis of geothermal energy systems and exergy, not research practice."}, {"id": "W7061279023", "tier": "OUT", "genre": "empirical", "about_ca": false, "confidence": "high", "reason": "Arctic climate, energy, and geopolitics with Canada as one state actor, not the research system."}, {"id": "W1999117615", "tier": "OUT", "genre": "empirical", "about_ca": false, "confidence": "medium", "reason": "Clinical comparison of cervical cancer surgical staging techniques; empty abstract but title is unambiguous domain care."}, {"id": "W1979737405", "tier": "OUT", "genre": "empirical", "about_ca": false, "confidence": "high", "reason": "Engineering PDE shape optimization for battery cooling, not study of research."}, {"id": "W2317576212", "tier": "OUT", "genre": "empirical", "about_ca": false, "confidence": "high", "reason": "Computational chemistry of an enzyme catalytic mechanism, not metaresearch."}, {"id": "W7038142358", "tier": "T3", "genre": "other", "about_ca": false, "confidence": "high", "reason": "Broadcast news and talk-show content about politics, food supply, and sports."}, {"id": "W4406430072", "tier": "OUT", "genre": "other", "about_ca": false, "confidence": "low", "reason": "Title is only a DOI string and abstract is missing, so content cannot be judged as metaresearch."}, {"id": "W2972796525", "tier": "OUT", "genre": "empirical", "about_ca": false, "confidence": "high", "reason": "Occupational health study of mining injury and compensation experiences, not research as object."}, {"id": "W1516189379", "tier": "OUT", "genre": "editorial/commentary", "about_ca": false, "confidence": "high", "reason": "Guest-editor introduction on family-business succession, not research practice."}, {"id": "W3043635544", "tier": "OUT", "genre": "empirical", "about_ca": false, "confidence": "high", "reason": "Biomedical pharmacology linking STAT3 inhibitors to TrxR1, not study of science."}, {"id": "W6904631679", "tier": "OUT", "genre": "other", "about_ca": false, "confidence": "high", "reason": "Historical business directory/gazetteer of British Columbia places, not research systems."}, {"id": "W2884933591", "tier": "OUT", "genre": "empirical", "about_ca": false, "confidence": "medium", "reason": "Bio-oil processing engineering title with missing abstract; domain technical work, not metaresearch."}, {"id": "W7067071139", "tier": "OUT", "genre": "empirical", "about_ca": false, "confidence": "high", "reason": "Media study of a bilingual documentary on Indigenous\u2013Canada relations, not Canadian research practice."}, {"id": "W1592945727", "tier": "OUT", "genre": "conceptual", "about_ca": false, "confidence": "high", "reason": "Theoretical microeconomics of mixed demand systems, not research as object."}, {"id": "W4406069521", "tier": "OUT", "genre": "empirical", "about_ca": false, "confidence": "medium", "reason": "Veterinary anatomical study of an ultrasound nerve block; empty abstract but clinical title is clear."}, {"id": "W2271878792", "tier": "OUT", "genre": "empirical", "about_ca": false, "confidence": "high", "reason": "Cancer therapeutics antibody characterization, not metaresearch."}, {"id": "W2900491918", "tier": "OUT", "genre": "other", "about_ca": false, "confidence": "low", "reason": "Regional economics title with no abstract; no indication the object is research itself."}, {"id": "W4406074153", "tier": "OUT", "genre": "empirical", "about_ca": false, "confidence": "high", "reason": "Immunotherapy engineering against AML immune evasion, domain biomedicine."}, {"id": "W2027338183", "tier": "OUT", "genre": "empirical", "about_ca": false, "confidence": "high", "reason": "Cell biology of SR-BI localization in membrane rafts, not research practice."}, {"id": "W1963746973", "tier": "OUT", "genre": "empirical", "about_ca": false, "confidence": "medium", "reason": "Networking paper on measuring Internet applications as a technical domain problem, not studying research systems."}, {"id": "W2025368948", "tier": "T2", "genre": "empirical", "about_ca": true, "confidence": "high", "reason": "Historical sociology of science on the institutionalization of university sociology in Quebec."}, {"id": "W3113156813", "tier": "OUT", "genre": "editorial/commentary", "about_ca": false, "confidence": "medium", "reason": "Literary book review of an Anne H\u00e9bert biography, not research practice."}, {"id": "W6977017479", "tier": "OUT", "genre": "other", "about_ca": false, "confidence": "low", "reason": "Supplementary file listing clinical QI/QA studies for airway registries, not study of research."}, {"id": "W2210125199", "tier": "OUT", "genre": "empirical", "about_ca": false, "confidence": "medium", "reason": "Psychology of bullying and school transition; empty abstract but domain title is clear."}, {"id": "W2393487253", "tier": "OUT", "genre": "empirical", "about_ca": false, "confidence": "high", "reason": "Plant toxicology of zinc on seed germination, not metaresearch."}, {"id": "W6885982827", "tier": "T3", "genre": "other", "about_ca": false, "confidence": "high", "reason": "Historical local newspaper notice, news/announcement genre outside the analytic corpus."}, {"id": "W4415317359", "tier": "OUT", "genre": "empirical", "about_ca": false, "confidence": "high", "reason": "Astrophysics of photodissociation regions with JWST, domain natural science."}, {"id": "W7049108689", "tier": "OUT", "genre": "policy", "about_ca": false, "confidence": "high", "reason": "Comparative health-policy analysis of medicine access; Canada is one of four systems, not research itself."}, {"id": "W3085703431", "tier": "OUT", "genre": "empirical", "about_ca": false, "confidence": "high", "reason": "Optical materials study of diatom frustules, not research practice."}, {"id": "W2136837426", "tier": "OUT", "genre": "empirical", "about_ca": false, "confidence": "high", "reason": "US political history of unemployment reform, not science or research systems."}, {"id": "W2191930876", "tier": "OUT", "genre": "empirical", "about_ca": false, "confidence": "high", "reason": "Behavioural ecology of frog fertility and mating signals, domain biology."}, {"id": "W2279282063", "tier": "OUT", "genre": "empirical", "about_ca": false, "confidence": "high", "reason": "Marine geomorphology method for mapping iceberg scours, domain science not research-about-research."}, {"id": "W7131214900", "tier": "OUT", "genre": "other", "about_ca": false, "confidence": "high", "reason": "Historical household census dataset for Los Angeles, not metaresearch."}, {"id": "W4390616918", "tier": "OUT", "genre": "empirical", "about_ca": false, "confidence": "high", "reason": "Environmental risk methodology for air toxics impacts on ecosystems, not research systems."}, {"id": "W4285224326", "tier": "OUT", "genre": "empirical", "about_ca": false, "confidence": "high", "reason": "Clinical imaging classifier for Alzheimer neurodegeneration and trial endpoints, not study of research practice."}, {"id": "W3002888167", "tier": "OUT", "genre": "conceptual", "about_ca": false, "confidence": "high", "reason": "Literary metapoetics about fiction writing, not scientific metaresearch."}, {"id": "W3019084548", "tier": "OUT", "genre": "empirical", "about_ca": false, "confidence": "high", "reason": "Clinical outcome-measure comparison for knee OA rehabilitation care, not research methods as object."}, {"id": "W2172197673", "tier": "OUT", "genre": "empirical", "about_ca": false, "confidence": "high", "reason": "Neurophysiology of bat amygdala responses to social calls, domain neuroscience."}, {"id": "W7115713506", "tier": "OUT", "genre": "empirical", "about_ca": false, "confidence": "high", "reason": "Geotechnical study of oil-sand tailings liquefaction risk, not metaresearch."}, {"id": "W4317951747", "tier": "OUT", "genre": "empirical", "about_ca": false, "confidence": "high", "reason": "Quasar luminosity function astronomy survey science, not research practice."}, {"id": "W7081996874", "tier": "OUT", "genre": "empirical", "about_ca": false, "confidence": "medium", "reason": "Environmental biogeochemistry of rhizosphere carbon after wildfire smoke; empty abstract but domain title."}, {"id": "W2756945311", "tier": "OUT", "genre": "editorial/commentary", "about_ca": false, "confidence": "high", "reason": "Literary reviews of poetry books, not research systems."}, {"id": "W2895391296", "tier": "OUT", "genre": "empirical", "about_ca": false, "confidence": "high", "reason": "Agronomy study of soil physical quality under sugarcane tillage, domain agriculture."}, {"id": "W4220777513", "tier": "OUT", "genre": "empirical", "about_ca": false, "confidence": "high", "reason": "Human-factors study predicting VR motion sickness, not study of research."}, {"id": "W2769726216", "tier": "OUT", "genre": "empirical", "about_ca": false, "confidence": "high", "reason": "Condensed-matter physics of plasmon modes in hybrid electron systems."}, {"id": "W2897766190", "tier": "OUT", "genre": "other", "about_ca": false, "confidence": "high", "reason": "Design thesis visualizing global e-waste, not research practice as object."}, {"id": "W2561411892", "tier": "OUT", "genre": "empirical", "about_ca": false, "confidence": "high", "reason": "Colonial history of Naqab Bedouin under the British Mandate, not metaresearch."}, {"id": "W2254501236", "tier": "OUT", "genre": "empirical", "about_ca": false, "confidence": "high", "reason": "Clinical cardiology guidance on prosthesis\u2013patient mismatch after valve replacement."}, {"id": "W577307268", "tier": "T3", "genre": "other", "about_ca": false, "confidence": "high", "reason": "Trade news item about reopening a shipyard, not research practice."}, {"id": "W4211058005", "tier": "OUT", "genre": "empirical", "about_ca": false, "confidence": "high", "reason": "Earth-system science on chemical weathering and climate, not research as object."}]