[
  {"id": "W6968038583", "tier": "OUT", "genre": "other", "about_ca": false, "confidence": "high", "reason": "Spam/junk Zenodo deposit with no scholarly content."},
  {"id": "W2961073700", "tier": "OUT", "genre": "other", "about_ca": false, "confidence": "high", "reason": "Comparative book on health system reform; the policy system studied is healthcare, not research."},
  {"id": "W1620473997", "tier": "OUT", "genre": "other", "about_ca": false, "confidence": "medium", "reason": "No abstract; a song concordance built as a music-teaching aid, not a study of research."},
  {"id": "W7000833655", "tier": "OUT", "genre": "other", "about_ca": false, "confidence": "high", "reason": "State legislative bill on pension credit; not about research."},
  {"id": "W4200023374", "tier": "OUT", "genre": "empirical", "about_ca": false, "confidence": "high", "reason": "Materials chemistry of 2D gas sensors."},
  {"id": "W2058184108", "tier": "OUT", "genre": "empirical", "about_ca": false, "confidence": "high", "reason": "Qualitative study of resilience in older adults."},
  {"id": "W4401835829", "tier": "OUT", "genre": "methods", "about_ca": false, "confidence": "high", "reason": "Clustering algorithm optimization; a computational method, not a study of research practice."},
  {"id": "W6892767752", "tier": "OUT", "genre": "other", "about_ca": false, "confidence": "high", "reason": "Spam/junk Zenodo deposit with no scholarly content."},
  {"id": "W7104436838", "tier": "OUT", "genre": "empirical", "about_ca": false, "confidence": "high", "reason": "Ethnographic dissertation on death and capitalism."},
  {"id": "W4206408059", "tier": "OUT", "genre": "empirical", "about_ca": false, "confidence": "medium", "reason": "Documentary analysis of school-teacher career and training policy; the workforce studied is teachers, not researchers."},
  {"id": "W1995445944", "tier": "T1", "genre": "other", "about_ca": false, "confidence": "medium", "reason": "The whole subject is research methodology: whether qualitative and quantitative methods can coexist under the dominance of evidence-based practice."},
  {"id": "W2330256417", "tier": "OUT", "genre": "methods", "about_ca": false, "confidence": "medium", "reason": "Conceptual framework for characterizing clinical handovers; the object is care transitions, so what we learn about is patient safety, not research."},
  {"id": "W2105292042", "tier": "OUT", "genre": "empirical", "about_ca": false, "confidence": "medium", "reason": "No abstract; health-services question about pacemaker implantation rates."},
  {"id": "W953321851", "tier": "OUT", "genre": "other", "about_ca": false, "confidence": "low", "reason": "No abstract; an LIS-venue piece on inclusive library services, which is user services rather than the T2 scope of researchers' information behavior, repositories or discovery."},
  {"id": "W49930622", "tier": "T1", "genre": "methods", "about_ca": false, "confidence": "medium", "reason": "Methods chapter on how cost-effectiveness analysis should be designed into surgical research studies; the object is research design."},
  {"id": "W7006466875", "tier": "OUT", "genre": "other", "about_ca": false, "confidence": "high", "reason": "Creative-practice thesis in theatre aesthetics."},
  {"id": "W4410513204", "tier": "OUT", "genre": "empirical", "about_ca": false, "confidence": "high", "reason": "Genetic association study of lupus."},
  {"id": "W71803060", "tier": "OUT", "genre": "methods", "about_ca": false, "confidence": "medium", "reason": "Comparison of MRI coil placements for measuring follicular fluid; a domain measurement technique, so the knowledge gained is about ovarian imaging."},
  {"id": "W2050755805", "tier": "OUT", "genre": "empirical", "about_ca": false, "confidence": "high", "reason": "Outcome study of a therapeutic riding camp."},
  {"id": "W1984116735", "tier": "OUT", "genre": "empirical", "about_ca": false, "confidence": "high", "reason": "Biochemistry of hagfish slime."},
  {"id": "W4384613149", "tier": "OUT", "genre": "empirical", "about_ca": false, "confidence": "high", "reason": "Museology study of playful mediation; the institution studied is the museum's public, not research."},
  {"id": "W7006075562", "tier": "OUT", "genre": "empirical", "about_ca": false, "confidence": "high", "reason": "Ecohydrology of plant-soil water isotopes."},
  {"id": "W2617284200", "tier": "OUT", "genre": "other", "about_ca": false, "confidence": "high", "reason": "Legal thesis on workplace injury compensation and accommodation."},
  {"id": "W2559585312", "tier": "OUT", "genre": "empirical", "about_ca": false, "confidence": "high", "reason": "Randomized trial of a rehabilitation intervention in cerebral palsy."},
  {"id": "W2758607421", "tier": "OUT", "genre": "other", "about_ca": false, "confidence": "medium", "reason": "Literary history of francophone Canadian literatures; the field institutionalized is literature, not research."},
  {"id": "W254730076", "tier": "OUT", "genre": "other", "about_ca": false, "confidence": "low", "reason": "No abstract; environmental philosophy essay with no visible research-practice object."},
  {"id": "W3152290077", "tier": "OUT", "genre": "empirical", "about_ca": false, "confidence": "high", "reason": "Experimental psychology of self-esteem and social media feedback."},
  {"id": "W3127419408", "tier": "OUT", "genre": "empirical", "about_ca": false, "confidence": "high", "reason": "Astronomy of AM CVn outbursts."},
  {"id": "W2906764890", "tier": "OUT", "genre": "empirical", "about_ca": false, "confidence": "high", "reason": "Program outcomes in occupational therapy."},
  {"id": "W3006537243", "tier": "OUT", "genre": "other", "about_ca": false, "confidence": "high", "reason": "Literary criticism of an existentialist novel."},
  {"id": "W7015074245", "tier": "OUT", "genre": "other", "about_ca": false, "confidence": "high", "reason": "Architecture thesis on renovating prefabricated housing."},
  {"id": "W2049843251", "tier": "OUT", "genre": "methods", "about_ca": false, "confidence": "high", "reason": "Geodetic instrument validation; a domain measurement method."},
  {"id": "W4387582796", "tier": "OUT", "genre": "empirical", "about_ca": false, "confidence": "high", "reason": "Social work study of support to foster families."},
  {"id": "W4401386471", "tier": "OUT", "genre": "empirical", "about_ca": false, "confidence": "high", "reason": "Sport psychology of abuse and coping in match officials."},
  {"id": "W2152805131", "tier": "OUT", "genre": "empirical", "about_ca": false, "confidence": "high", "reason": "Clinical neuropsychology of sport concussion."},
  {"id": "W2801444771", "tier": "OUT", "genre": "empirical", "about_ca": false, "confidence": "high", "reason": "Theatre history case study of a commemorative play."},
  {"id": "W1549839306", "tier": "OUT", "genre": "empirical", "about_ca": false, "confidence": "high", "reason": "Industrial relations study of union discourse."},
  {"id": "W2917932941", "tier": "OUT", "genre": "empirical", "about_ca": false, "confidence": "high", "reason": "Critical discourse analysis of political speeches."},
  {"id": "W6904859136", "tier": "OUT", "genre": "other", "about_ca": false, "confidence": "medium", "reason": "No abstract; an archival photograph record of a groundbreaking ceremony."},
  {"id": "W7110671876", "tier": "OUT", "genre": "other", "about_ca": false, "confidence": "low", "reason": "University board meeting minutes; an institutional governance record dominated by naming and personnel items rather than a policy statement about research."},
  {"id": "W172397282", "tier": "OUT", "genre": "other", "about_ca": false, "confidence": "low", "reason": "No abstract; title gives no indication of a research-practice object."},
  {"id": "W4390961899", "tier": "OUT", "genre": "other", "about_ca": false, "confidence": "high", "reason": "Pure mathematics of Bernstein-Sato polynomials."},
  {"id": "W4318919636", "tier": "OUT", "genre": "empirical", "about_ca": false, "confidence": "high", "reason": "Exercise physiology in a muscular dystrophy model."},
  {"id": "W2404000990", "tier": "OUT", "genre": "empirical", "about_ca": false, "confidence": "medium", "reason": "No abstract; prediction of academic success in nursing education, not of a research career."},
  {"id": "W2614257424", "tier": "OUT", "genre": "empirical", "about_ca": false, "confidence": "high", "reason": "Ecotoxicology of mercury in fish."},
  {"id": "W2660147652", "tier": "OUT", "genre": "empirical", "about_ca": false, "confidence": "high", "reason": "Aerodynamics of plasma actuators."},
  {"id": "W3044455566", "tier": "OUT", "genre": "empirical", "about_ca": false, "confidence": "medium", "reason": "No abstract; economic impact of COVID-19 on regional output."},
  {"id": "W2911901311", "tier": "OUT", "genre": "review", "about_ca": false, "confidence": "medium", "reason": "No abstract; review of the clinical epilepsy nurse role, a care workforce rather than the research workforce."},
  {"id": "W6949273621", "tier": "OUT", "genre": "dataset", "about_ca": false, "confidence": "high", "reason": "Data and code deposit for an ornithology paper; an artifact of data sharing, not a study of it."},
  {"id": "W2104815409", "tier": "T2", "genre": "review", "about_ca": false, "confidence": "low", "reason": "Systematic critique of how Western political science has researched the Communist Youth League, so the object is a body of scholarship and its biases, though the aim is also a substantive political claim."}
]
