[{"id": "W4313181752", "tier": "OUT", "genre": "other", "about_ca": false, "confidence": "low"}, {"id": "W3097525070", "tier": "OUT", "genre": "other", "about_ca": false, "confidence": "low"}, {"id": "W4313124142", "tier": "OUT", "genre": "other", "about_ca": false, "confidence": "low"}, {"id": "W3097235679", "tier": "OUT", "genre": "other", "about_ca": false, "confidence": "low"}, {"id": "W4361223572", "tier": "OUT", "genre": "other", "about_ca": false, "confidence": "low"}, {"id": "W3095469957", "tier": "OUT", "genre": "other", "about_ca": false, "confidence": "low"}, {"id": "W3095002864", "tier": "OUT", "genre": "other", "about_ca": true, "confidence": "low"}, {"id": "W3097392277", "tier": "OUT", "genre": "other", "about_ca": false, "confidence": "low"}, {"id": "W3097162801", "tier": "OUT", "genre": "other", "about_ca": true, "confidence": "low"}, {"id": "W3095061411", "tier": "OUT", "genre": "other", "about_ca": false, "confidence": "low"}, {"id": "W3096036638", "tier": "OUT", "genre": "other", "about_ca": false, "confidence": "low"}, {"id": "W2983380516", "tier": "OUT", "genre": "other", "about_ca": false, "confidence": "high"}, {"id": "W2984357367", "tier": "OUT", "genre": "other", "about_ca": true, "confidence": "low"}, {"id": "W3017334309", "tier": "OUT", "genre": "other", "about_ca": false, "confidence": "low"}, {"id": "W3094816041", "tier": "OUT", "genre": "other", "about_ca": false, "confidence": "low"}, {"id": "W3097484254", "tier": "OUT", "genre": "other", "about_ca": false, "confidence": "low"}, {"id": "W3095649309", "tier": "OUT", "genre": "other", "about_ca": true, "confidence": "low"}, {"id": "W3097334830", "tier": "OUT", "genre": "other", "about_ca": false, "confidence": "low"}, {"id": "W3094908653", "tier": "OUT", "genre": "other", "about_ca": true, "confidence": "low"}, {"id": "W3096481591", "tier": "OUT", "genre": "other", "about_ca": false, "confidence": "low"}, {"id": "W4313156857", "tier": "OUT", "genre": "other", "about_ca": false, "confidence": "low"}, {"id": "W3097243984", "tier": "OUT", "genre": "other", "about_ca": false, "confidence": "low"}, {"id": "W3095567248", "tier": "OUT", "genre": "other", "about_ca": true, "confidence": "low"}, {"id": "W3097776218", "tier": "OUT", "genre": "other", "about_ca": false, "confidence": "low"}, {"id": "W2982221964", "tier": "OUT", "genre": "other", "about_ca": false, "confidence": "low"}, {"id": "W3095482853", "tier": "OUT", "genre": "other", "about_ca": false, "confidence": "low"}, {"id": "W3096691064", "tier": "OUT", "genre": "other", "about_ca": false, "confidence": "low"}, {"id": "W3097670740", "tier": "OUT", "genre": "other", "about_ca": true, "confidence": "low"}, {"id": "W4391339284", "tier": "OUT", "genre": "other", "about_ca": false, "confidence": "low"}, {"id": "W3096012248", "tier": "OUT", "genre": "other", "about_ca": false, "confidence": "low"}, {"id": "W4391231778", "tier": "OUT", "genre": "other", "about_ca": false, "confidence": "high"}, {"id": "W3017334289", "tier": "OUT", "genre": "other", "about_ca": true, "confidence": "low"}, {"id": "W4390169609", "tier": "OUT", "genre": "other", "about_ca": false, "confidence": "low"}, {"id": "W3095030030", "tier": "OUT", "genre": "other", "about_ca": false, "confidence": "low"}, {"id": "W3016964361", "tier": "OUT", "genre": "other", "about_ca": false, "confidence": "low"}, {"id": "W3097811495", "tier": "OUT", "genre": "other", "about_ca": false, "confidence": "low"}, {"id": "W3097309151", "tier": "OUT", "genre": "other", "about_ca": false, "confidence": "low"}, {"id": "W4415631913", "tier": "OUT", "genre": "other", "about_ca": false, "confidence": "high"}, {"id": "W4415322292", "tier": "OUT", "genre": "other", "about_ca": false, "confidence": "low"}, {"id": "W4414337746", "tier": "OUT", "genre": "other", "about_ca": false, "confidence": "low"}, {"id": "W4416918399", "tier": "OUT", "genre": "other", "about_ca": false, "confidence": "low"}, {"id": "W4415097894", "tier": "OUT", "genre": "other", "about_ca": false, "confidence": "low"}, {"id": "W4417355619", "tier": "OUT", "genre": "other", "about_ca": false, "confidence": "high"}, {"id": "W3208506976", "tier": "OUT", "genre": "other", "about_ca": false, "confidence": "low"}, {"id": "W3211051001", "tier": "OUT", "genre": "other", "about_ca": false, "confidence": "low"}, {"id": "W3135837314", "tier": "OUT", "genre": "other", "about_ca": true, "confidence": "low"}, {"id": "W3170043047", "tier": "OUT", "genre": "other", "about_ca": false, "confidence": "high"}, {"id": "W3111604600", "tier": "OUT", "genre": "other", "about_ca": false, "confidence": "high"}, {"id": "W3158488799", "tier": "OUT", "genre": "other", "about_ca": false, "confidence": "low"}, {"id": "W3164576348", "tier": "OUT", "genre": "other", "about_ca": false, "confidence": "high"}, {"id": "W3208133108", "tier": "OUT", "genre": "other", "about_ca": false, "confidence": "low"}, {"id": "W3210656403", "tier": "OUT", "genre": "other", "about_ca": false, "confidence": "low"}, {"id": "W3211989444", "tier": "OUT", "genre": "other", "about_ca": false, "confidence": "low"}, {"id": "W3128184537", "tier": "OUT", "genre": "other", "about_ca": false, "confidence": "high"}, {"id": "W3212065522", "tier": "OUT", "genre": "other", "about_ca": false, "confidence": "high"}, {"id": "W3205721541", "tier": "T2", "genre": "empirical", "about_ca": false, "confidence": "high"}, {"id": "W3210979781", "tier": "OUT", "genre": "other", "about_ca": false, "confidence": "low"}, {"id": "W3217435238", "tier": "OUT", "genre": "other", "about_ca": false, "confidence": "low"}, {"id": "W3134652992", "tier": "OUT", "genre": "other", "about_ca": true, "confidence": "high"}, {"id": "W3208135117", "tier": "OUT", "genre": "other", "about_ca": false, "confidence": "low"}, {"id": "W3210747760", "tier": "OUT", "genre": "other", "about_ca": false, "confidence": "low"}, {"id": "W3210901743", "tier": "OUT", "genre": "other", "about_ca": true, "confidence": "low"}, {"id": "W3208354647", "tier": "OUT", "genre": "other", "about_ca": false, "confidence": "low"}, {"id": "W3211058318", "tier": "OUT", "genre": "other", "about_ca": false, "confidence": "low"}, {"id": "W4240103597", "tier": "OUT", "genre": "other", "about_ca": false, "confidence": "high"}, {"id": "W4242313374", "tier": "OUT", "genre": "other", "about_ca": false, "confidence": "low"}, {"id": "W4229484848", "tier": "OUT", "genre": "other", "about_ca": false, "confidence": "low"}, {"id": "W4225081535", "tier": "OUT", "genre": "other", "about_ca": false, "confidence": "high"}, {"id": "W4235439873", "tier": "OUT", "genre": "other", "about_ca": false, "confidence": "low"}, {"id": "W4237393065", "tier": "OUT", "genre": "other", "about_ca": false, "confidence": "low"}, {"id": "W4233379462", "tier": "OUT", "genre": "other", "about_ca": false, "confidence": "low"}, {"id": "W4226379735", "tier": "OUT", "genre": "other", "about_ca": false, "confidence": "low"}, {"id": "W4229921108", "tier": "OUT", "genre": "other", "about_ca": false, "confidence": "low"}, {"id": "W4206824173", "tier": "OUT", "genre": "other", "about_ca": false, "confidence": "high"}, {"id": "W4234706650", "tier": "OUT", "genre": "other", "about_ca": false, "confidence": "low"}, {"id": "W1967288315", "tier": "OUT", "genre": "other", "about_ca": false, "confidence": "high"}, {"id": "W1492026114", "tier": "OUT", "genre": "other", "about_ca": false, "confidence": "high"}, {"id": "W1955543122", "tier": "OUT", "genre": "other", "about_ca": false, "confidence": "high"}, {"id": "W1973598165", "tier": "OUT", "genre": "other", "about_ca": false, "confidence": "high"}, {"id": "W1971733390", "tier": "OUT", "genre": "other", "about_ca": false, "confidence": "high"}, {"id": "W1771508005", "tier": "OUT", "genre": "other", "about_ca": false, "confidence": "high"}, {"id": "W1996990230", "tier": "OUT", "genre": "other", "about_ca": false, "confidence": "high"}, {"id": "W1996889897", "tier": "OUT", "genre": "other", "about_ca": false, "confidence": "high"}, {"id": "W2000836605", "tier": "OUT", "genre": "other", "about_ca": false, "confidence": "high"}, {"id": "W2734696585", "tier": "OUT", "genre": "other", "about_ca": false, "confidence": "low"}, {"id": "W2616924719", "tier": "OUT", "genre": "other", "about_ca": false, "confidence": "high"}, {"id": "W2076687053", "tier": "OUT", "genre": "other", "about_ca": false, "confidence": "high"}, {"id": "W2081151603", "tier": "OUT", "genre": "other", "about_ca": false, "confidence": "high"}, {"id": "W2080069712", "tier": "OUT", "genre": "other", "about_ca": false, "confidence": "low"}, {"id": "W2083248748", "tier": "OUT", "genre": "other", "about_ca": false, "confidence": "high"}, {"id": "W2080939902", "tier": "OUT", "genre": "other", "about_ca": false, "confidence": "high"}, {"id": "W2088948404", "tier": "OUT", "genre": "other", "about_ca": false, "confidence": "high"}, {"id": "W2097242983", "tier": "OUT", "genre": "other", "about_ca": false, "confidence": "high"}, {"id": "W2093172198", "tier": "OUT", "genre": "other", "about_ca": false, "confidence": "high"}, {"id": "W2082997720", "tier": "OUT", "genre": "other", "about_ca": false, "confidence": "high"}, {"id": "W2090303758", "tier": "OUT", "genre": "other", "about_ca": false, "confidence": "high"}, {"id": "W2072881659", "tier": "OUT", "genre": "other", "about_ca": false, "confidence": "high"}, {"id": "W2074663968", "tier": "OUT", "genre": "other", "about_ca": false, "confidence": "high"}, {"id": "W2076540075", "tier": "OUT", "genre": "other", "about_ca": false, "confidence": "low"}, {"id": "W2074609614", "tier": "OUT", "genre": "other", "about_ca": false, "confidence": "high"}]