[{"id": "W2130206575", "tier": "OUT", "genre": "other", "about_ca": false, "confidence": "high"}, {"id": "W4251018601", "tier": "OUT", "genre": "other", "about_ca": false, "confidence": "high"}, {"id": "W2131387666", "tier": "OUT", "genre": "other", "about_ca": false, "confidence": "high"}, {"id": "W4312296100", "tier": "OUT", "genre": "other", "about_ca": false, "confidence": "high"}, {"id": "W4312565532", "tier": "OUT", "genre": "other", "about_ca": false, "confidence": "high"}, {"id": "W4293242898", "tier": "OUT", "genre": "other", "about_ca": false, "confidence": "high"}, {"id": "W2105688210", "tier": "OUT", "genre": "other", "about_ca": false, "confidence": "high"}, {"id": "W2144845209", "tier": "OUT", "genre": "other", "about_ca": false, "confidence": "high"}, {"id": "W2129650438", "tier": "OUT", "genre": "other", "about_ca": false, "confidence": "high"}, {"id": "W2140718500", "tier": "T1", "genre": "empirical", "about_ca": false, "confidence": "high"}, {"id": "W2131105189", "tier": "T2", "genre": "empirical", "about_ca": false, "confidence": "medium"}, {"id": "W4312649697", "tier": "OUT", "genre": "other", "about_ca": false, "confidence": "high"}, {"id": "W2129531457", "tier": "OUT", "genre": "other", "about_ca": false, "confidence": "high"}, {"id": "W2115398507", "tier": "OUT", "genre": "other", "about_ca": false, "confidence": "high"}, {"id": "W2118398969", "tier": "OUT", "genre": "other", "about_ca": false, "confidence": "high"}, {"id": "W4281732948", "tier": "OUT", "genre": "other", "about_ca": false, "confidence": "high"}, {"id": "W4256353345", "tier": "OUT", "genre": "other", "about_ca": false, "confidence": "high"}, {"id": "W2139795441", "tier": "OUT", "genre": "other", "about_ca": false, "confidence": "high"}, {"id": "W2108545269", "tier": "OUT", "genre": "other", "about_ca": false, "confidence": "high"}, {"id": "W4312781698", "tier": "OUT", "genre": "other", "about_ca": false, "confidence": "high"}, {"id": "W4312739214", "tier": "OUT", "genre": "other", "about_ca": false, "confidence": "high"}, {"id": "W2143610656", "tier": "OUT", "genre": "other", "about_ca": false, "confidence": "high"}, {"id": "W4312312785", "tier": "OUT", "genre": "other", "about_ca": false, "confidence": "high"}, {"id": "W2903649596", "tier": "OUT", "genre": "other", "about_ca": false, "confidence": "high"}, {"id": "W4387610346", "tier": "OUT", "genre": "other", "about_ca": false, "confidence": "high"}, {"id": "W4382931285", "tier": "OUT", "genre": "other", "about_ca": false, "confidence": "high"}, {"id": "W4387610341", "tier": "OUT", "genre": "other", "about_ca": false, "confidence": "high"}, {"id": "W2953345044", "tier": "OUT", "genre": "other", "about_ca": false, "confidence": "high"}, {"id": "W2902140665", "tier": "OUT", "genre": "other", "about_ca": false, "confidence": "high"}, {"id": "W4386928528", "tier": "T3", "genre": "editorial", "about_ca": false, "confidence": "high"}, {"id": "W4313191687", "tier": "OUT", "genre": "other", "about_ca": false, "confidence": "high"}, {"id": "W2313502502", "tier": "OUT", "genre": "other", "about_ca": false, "confidence": "high"}, {"id": "W2319427838", "tier": "OUT", "genre": "other", "about_ca": false, "confidence": "high"}, {"id": "W2327969297", "tier": "OUT", "genre": "other", "about_ca": false, "confidence": "high"}, {"id": "W2155953092", "tier": "OUT", "genre": "other", "about_ca": false, "confidence": "high"}, {"id": "W2180183316", "tier": "OUT", "genre": "other", "about_ca": false, "confidence": "high"}, {"id": "W2153474070", "tier": "OUT", "genre": "other", "about_ca": false, "confidence": "high"}, {"id": "W2148623326", "tier": "T2", "genre": "empirical", "about_ca": false, "confidence": "medium"}, {"id": "W2165176570", "tier": "OUT", "genre": "other", "about_ca": false, "confidence": "high"}, {"id": "W2746358630", "tier": "OUT", "genre": "other", "about_ca": false, "confidence": "high"}, {"id": "W2221501852", "tier": "T3", "genre": "editorial", "about_ca": false, "confidence": "high"}, {"id": "W2900703214", "tier": "OUT", "genre": "other", "about_ca": false, "confidence": "high"}, {"id": "W2803920522", "tier": "OUT", "genre": "other", "about_ca": false, "confidence": "high"}, {"id": "W2168531846", "tier": "OUT", "genre": "other", "about_ca": false, "confidence": "high"}, {"id": "W2545518076", "tier": "OUT", "genre": "other", "about_ca": false, "confidence": "high"}, {"id": "W2970053044", "tier": "OUT", "genre": "other", "about_ca": false, "confidence": "high"}, {"id": "W2296403033", "tier": "OUT", "genre": "other", "about_ca": false, "confidence": "high"}, {"id": "W2274577657", "tier": "OUT", "genre": "other", "about_ca": false, "confidence": "high"}, {"id": "W2316778796", "tier": "OUT", "genre": "other", "about_ca": false, "confidence": "high"}, {"id": "W2750982206", "tier": "OUT", "genre": "other", "about_ca": false, "confidence": "high"}, {"id": "W2189756161", "tier": "OUT", "genre": "other", "about_ca": false, "confidence": "high"}, {"id": "W2922906137", "tier": "OUT", "genre": "other", "about_ca": false, "confidence": "high"}, {"id": "W2169811924", "tier": "T3", "genre": "editorial", "about_ca": false, "confidence": "high"}, {"id": "W2405471703", "tier": "OUT", "genre": "other", "about_ca": false, "confidence": "high"}, {"id": "W2328836612", "tier": "OUT", "genre": "other", "about_ca": false, "confidence": "high"}, {"id": "W2316141470", "tier": "OUT", "genre": "other", "about_ca": false, "confidence": "high"}, {"id": "W2320747503", "tier": "OUT", "genre": "other", "about_ca": false, "confidence": "high"}, {"id": "W1885693054", "tier": "OUT", "genre": "other", "about_ca": false, "confidence": "high"}, {"id": "W1977382872", "tier": "OUT", "genre": "other", "about_ca": false, "confidence": "high"}, {"id": "W2022731417", "tier": "OUT", "genre": "other", "about_ca": false, "confidence": "high"}, {"id": "W2023322792", "tier": "OUT", "genre": "other", "about_ca": false, "confidence": "high"}, {"id": "W2021072381", "tier": "OUT", "genre": "other", "about_ca": false, "confidence": "high"}, {"id": "W2017451654", "tier": "OUT", "genre": "other", "about_ca": false, "confidence": "high"}, {"id": "W2023242530", "tier": "OUT", "genre": "other", "about_ca": false, "confidence": "high"}, {"id": "W2019665042", "tier": "OUT", "genre": "other", "about_ca": false, "confidence": "high"}, {"id": "W2018262559", "tier": "OUT", "genre": "other", "about_ca": false, "confidence": "high"}, {"id": "W2023147995", "tier": "OUT", "genre": "other", "about_ca": false, "confidence": "high"}, {"id": "W4312414211", "tier": "OUT", "genre": "other", "about_ca": false, "confidence": "high"}, {"id": "W4312593104", "tier": "OUT", "genre": "other", "about_ca": false, "confidence": "high"}, {"id": "W2549018106", "tier": "OUT", "genre": "other", "about_ca": false, "confidence": "high"}, {"id": "W2743388229", "tier": "OUT", "genre": "other", "about_ca": false, "confidence": "high"}, {"id": "W2515270739", "tier": "OUT", "genre": "other", "about_ca": false, "confidence": "high"}, {"id": "W2721550762", "tier": "OUT", "genre": "other", "about_ca": false, "confidence": "high"}, {"id": "W2622171693", "tier": "OUT", "genre": "other", "about_ca": false, "confidence": "high"}, {"id": "W2727933322", "tier": "OUT", "genre": "other", "about_ca": false, "confidence": "high"}, {"id": "W1997943693", "tier": "OUT", "genre": "other", "about_ca": false, "confidence": "high"}, {"id": "W1996158105", "tier": "OUT", "genre": "other", "about_ca": false, "confidence": "high"}, {"id": "W2016078217", "tier": "OUT", "genre": "other", "about_ca": false, "confidence": "high"}, {"id": "W1975554241", "tier": "OUT", "genre": "other", "about_ca": false, "confidence": "high"}, {"id": "W7107948350", "tier": "OUT", "genre": "other", "about_ca": false, "confidence": "high"}, {"id": "W3126318718", "tier": "OUT", "genre": "other", "about_ca": false, "confidence": "high"}, {"id": "W3137592343", "tier": "OUT", "genre": "other", "about_ca": false, "confidence": "high"}, {"id": "W3008423546", "tier": "OUT", "genre": "other", "about_ca": false, "confidence": "high"}, {"id": "W2049368162", "tier": "OUT", "genre": "other", "about_ca": false, "confidence": "high"}, {"id": "W2069385352", "tier": "OUT", "genre": "other", "about_ca": false, "confidence": "high"}, {"id": "W2067292557", "tier": "OUT", "genre": "other", "about_ca": false, "confidence": "high"}, {"id": "W2049809317", "tier": "OUT", "genre": "other", "about_ca": false, "confidence": "high"}, {"id": "W2060096504", "tier": "OUT", "genre": "other", "about_ca": false, "confidence": "high"}, {"id": "W2050464737", "tier": "OUT", "genre": "other", "about_ca": false, "confidence": "high"}, {"id": "W2059234368", "tier": "OUT", "genre": "other", "about_ca": false, "confidence": "high"}, {"id": "W2066883769", "tier": "OUT", "genre": "other", "about_ca": false, "confidence": "high"}, {"id": "W2057630337", "tier": "OUT", "genre": "other", "about_ca": false, "confidence": "high"}, {"id": "W2057527827", "tier": "T3", "genre": "editorial", "about_ca": false, "confidence": "high"}, {"id": "W2054082789", "tier": "OUT", "genre": "other", "about_ca": false, "confidence": "high"}, {"id": "W2064334285", "tier": "OUT", "genre": "other", "about_ca": false, "confidence": "high"}, {"id": "W2066963502", "tier": "OUT", "genre": "other", "about_ca": false, "confidence": "high"}, {"id": "W2070332785", "tier": "OUT", "genre": "other", "about_ca": false, "confidence": "high"}, {"id": "W2052335522", "tier": "OUT", "genre": "other", "about_ca": false, "confidence": "high"}, {"id": "W2056909556", "tier": "OUT", "genre": "other", "about_ca": false, "confidence": "high"}, {"id": "W2065069575", "tier": "OUT", "genre": "other", "about_ca": false, "confidence": "high"}]