[{"id": "W2265964962", "tier": "OUT", "genre": "commentary", "about_ca": false, "confidence": "medium", "reason": "Object is university performance management and organizational change in higher education, not research practice as such."}, {"id": "W2976428202", "tier": "OUT", "genre": "empirical", "about_ca": false, "confidence": "high", "reason": "History of politics as a taught curriculum in UK universities concerns teaching and higher education, not research practice."}, {"id": "W3145338206", "tier": "OUT", "genre": "empirical", "about_ca": false, "confidence": "high", "reason": "Object is transnational technology innovation for sustainable development sectors, not science or research as the studied practice (RULE 2)."}, {"id": "W2590116164", "tier": "OUT", "genre": "empirical", "about_ca": false, "confidence": "high", "reason": "Primary object is DTI-based Alzheimer's classification; feature-selection bias is a domain methods issue within that task, not a study of research practice."}, {"id": "W4386977249", "tier": "T1", "genre": "empirical", "about_ca": false, "confidence": "high", "reason": "Replicates and critiques a published neuromorphic learning study, objecting to its claims, dataset, and generalisation as research practice."}, {"id": "W2806906455", "tier": "T1", "genre": "methods", "about_ca": false, "confidence": "medium", "reason": "Shows that patent classification schemas change quantitative findings in innovation research, so the object is analytic-choice sensitivity in that literature."}, {"id": "W1971156133", "tier": "OUT", "genre": "methods", "about_ca": false, "confidence": "high", "reason": "Develops an SCFG technique for analyzing RDS survey data in a domain population (RULE 1: builds a method, does not study methods as practiced)."}, {"id": "W7055519161", "tier": "OUT", "genre": "other", "about_ca": false, "confidence": "high", "reason": "Edited collection primarily on Ghanaian archaeology and heritage practice, not metaresearch as the main object."}, {"id": "W2953894287", "tier": "OUT", "genre": "empirical", "about_ca": false, "confidence": "high", "reason": "Sociological study of an environmental impact assessment for a Colombian dam; STS method with a non-research object (RULE 2)."}, {"id": "W580944977", "tier": "OUT", "genre": "other", "about_ca": false, "confidence": "medium", "reason": "Campus library collaboration and student-support services, not information behaviour of researchers or scholarly infrastructure as research object."}, {"id": "W7096346612", "tier": "OUT", "genre": "empirical", "about_ca": true, "confidence": "medium", "reason": "Collegial governance of academic librarians at Brock is higher-education institutional governance, not the research workforce or research practice."}, {"id": "W2810879288", "tier": "OUT", "genre": "empirical", "about_ca": false, "confidence": "high", "reason": "Compares program-evaluation planning tools for a Learning Community Program, not research evaluation or research methods as practiced."}, {"id": "W2946125747", "tier": "T2", "genre": "commentary", "about_ca": true, "confidence": "high", "reason": "Policy briefing on security risks to Canadian research supercomputing infrastructure (Compute Canada), so object is the Canadian research ecosystem."}, {"id": "W2771527454", "tier": "OUT", "genre": "empirical", "about_ca": false, "confidence": "high", "reason": "Education study of student perceptions of social science and scientists, not research practice or the research workforce."}, {"id": "W1933764499", "tier": "T2", "genre": "empirical", "about_ca": true, "confidence": "high", "reason": "Case study of theatre archives outreach and archival functions at a Canadian university, objecting to archival practice in the research ecosystem."}, {"id": "W2756169793", "tier": "T1", "genre": "review", "about_ca": false, "confidence": "medium", "reason": "Evidence summary of research on #icanhazpdf scholarly sharing of health literature; object is scholarly communication practice."}, {"id": "W4399855826", "tier": "OUT", "genre": "empirical", "about_ca": false, "confidence": "high", "reason": "Validates whether radio transmitters affect sparrow physiology in field ecology (RULE 1: instrument effects in a domain study)."}, {"id": "W2175161454", "tier": "OUT", "genre": "methods", "about_ca": false, "confidence": "high", "reason": "Develops and validates simulated maximum likelihood estimation for fisheries population models (RULE 1)."}, {"id": "W3196558450", "tier": "OUT", "genre": "methods", "about_ca": false, "confidence": "high", "reason": "Proposes a new high-breakdown multivariate scatter and location estimator (RULE 1; classic methods-development OUT)."}, {"id": "W2322153589", "tier": "T1", "genre": "empirical", "about_ca": false, "confidence": "medium", "reason": "Links foreign academic staff counts to university academic performance ratings, objecting to research workforce and evaluation metrics."}, {"id": "W2901282154", "tier": "T1", "genre": "review", "about_ca": true, "confidence": "high", "reason": "Object is statute-based confidentiality protections for research participants and implications for Canadian research governance."}, {"id": "W7132947126", "tier": "OUT", "genre": "empirical", "about_ca": false, "confidence": "medium", "reason": "Evaluates student benefits of a Brazilian study-abroad scholarship program; higher-education mobility, not research practice as object."}, {"id": "W4417238122", "tier": "T1", "genre": "commentary", "about_ca": false, "confidence": "high", "reason": "Object is decolonial and indigenous research practices and knowledge production, i.e. how research is done and governed."}, {"id": "W3157448507", "tier": "T2", "genre": "empirical", "about_ca": false, "confidence": "high", "reason": "Bibliometric characterization of African COVID-19 scholarly output and collaboration patterns (literature map, not research-practice metrics)."}, {"id": "W6948001283", "tier": "T2", "genre": "other", "about_ca": true, "confidence": "medium", "reason": "Evaluation report on NRC's industrial research assistance program for Canadian SMEs; research and innovation policy, not core metaresearch methods."}, {"id": "W3217745904", "tier": "T3", "genre": "commentary", "about_ca": false, "confidence": "medium", "reason": "Research note on why linguistics has not studied death; commentary on a field's research agenda rather than systematic metaresearch."}, {"id": "W7133065251", "tier": "OUT", "genre": "empirical", "about_ca": false, "confidence": "medium", "reason": "Bourdieusian study of faculty experience in Pakistani higher education is higher-education research, not the research workforce as metaresearch object."}, {"id": "W2104815409", "tier": "T2", "genre": "review", "about_ca": false, "confidence": "medium", "reason": "Reviews how Western political science has studied China's Communist Youth League, characterizing that research literature and its approaches."}, {"id": "W4239704798", "tier": "T3", "genre": "commentary", "about_ca": false, "confidence": "high", "reason": "Opinion piece arguing that novels are legitimate objects for qualitative social research; commentary on research practice, not empirical metaresearch."}]